date,order_id,customer_id,product,revenue
2019-01-12 11:00:00,69795,364754b9-56fd-49b5-b6fb-d1fca7ca82f9,Гладильная доска НИКА LORA FASHION HLF 123х46 см,1912.0
2019-01-12 11:00:00,69796,364754b9-56fd-49b5-b6fb-d1fca7ca82f9,Гладильная доска НИКА LORA FASHION HLF 123х46 см,1912.0
2019-01-12 19:00:00,14522,eb6521ae-56e3-4a72-9ea2-e9c69701ff3f,Пеларгония зональная диам. 12 см белая махровая,150.0
2019-01-12 19:00:00,14522,eb6521ae-56e3-4a72-9ea2-e9c69701ff3f,Пеларгония зональная диам. 12 см коралловая полумахровая,188.0
2019-01-12 19:00:00,14522,eb6521ae-56e3-4a72-9ea2-e9c69701ff3f,Пеларгония зональная диам. 12 см красный махровый,150.0
2019-01-12 19:00:00,14522,eb6521ae-56e3-4a72-9ea2-e9c69701ff3f,Пеларгония зональная диам. 12 см лососевая махровая,150.0
2019-01-12 19:00:00,14522,eb6521ae-56e3-4a72-9ea2-e9c69701ff3f,Пеларгония зональная диам. 12 см розово-красная полумахровая,150.0
2019-01-12 19:00:00,14522,eb6521ae-56e3-4a72-9ea2-e9c69701ff3f,Пеларгония зональная диам. 12 см сиреневый полумахровый,150.0
2019-01-12 19:00:00,14522,eb6521ae-56e3-4a72-9ea2-e9c69701ff3f,Пеларгония зональная диам. 12 см темнорозовая полумахровая,150.0
2019-01-12 19:00:00,14522,eb6521ae-56e3-4a72-9ea2-e9c69701ff3f,Пеларгония зональная простая цвет фуксии,150.0
2019-01-12 19:00:00,14522,eb6521ae-56e3-4a72-9ea2-e9c69701ff3f,Пеларгония зональная РОЗОЦВЕТНАЯ Маргарита лососевая 5-7 листов,90.0
2019-01-12 19:00:00,14522,eb6521ae-56e3-4a72-9ea2-e9c69701ff3f,Пеларгония розоцветная РЕД РОЗЕБУД молодые растения,90.0
2019-01-12 20:00:00,69797,4bd9d82b-9942-4ad6-b6e6-b22c84353848,"Блюдце УТРО ЭКЛИПС, J3261, Luminarc, Франция",590.0
2019-01-13 09:00:00,69800,fd81297f-0495-4045-be04-d65061ab5e98,Скатерть Ажурная d-ia Rose круглая д.152 белая 5173 Towa Co. LTd-,712.0
2019-01-13 15:00:00,69802,da9935fd-30de-45f9-a87e-e954a391ee2b,Муляж Персики мини полиуретан d-6 см,1.0
2019-01-13 17:00:00,69804,5a47c305-d92a-448e-a68d-471a5da9eb05,Сушилка для белья на ванну НИКА СБ4,898.0
2019-01-13 20:00:00,69805,74b9458b-8464-42bd-bd25-a09df27e7124,"Штора для ванной 180х200 см, Rigone Зеленый",937.0
2019-01-13 21:00:00,69806,079ae16b-f498-4cca-bd1b-2919cb650c3a,Тарелка десертная МОКА БРАУН 19 см H7013 Luminarc,518.0
2019-01-13 22:00:00,69807,0982f6b9-328f-4a67-b7ee-cd0a114868f0,"Контейнер для СВЧ Полимербыт Премиум 1,2 л 4356200",59.0
2019-01-14 09:00:00,69812,ea4043a9-1864-430a-9b4c-d8286915bf10,Подкладка под чехол Zalger 520140 135х50 см поролон,127.0
2019-01-14 13:00:00,69818,3b21f626-e3f2-41c0-9b20-614c95bb4fa4,Сушилка для белья напольная НИКА СБ1Г 18 м бело-голубая,652.0
2019-01-14 14:00:00,69821,7f0b1b68-7569-41f9-9d5f-28d7e1905f44,"Коврик ворсовый для ванной комнаты OrthoSpa River Rocks natural из микрофибры и ПВХ прямоугольный 50х85 см серо-коричневый, Apac",1874.0
2019-01-14 18:00:00,69824,10b8dc5a-0332-4286-8e80-97f197cbc84e,Хлорофитум d-13 см,112.0
2019-01-14 21:00:00,69825,6da7e5e8-060b-4116-91ef-015b33965d68,Фиттония Скелетон d-9 см,157.0
2019-01-15 08:00:00,69826,f71a41ab-df06-4c9f-a4bf-474e368a40d2,Вешалка-плечики без эссенции цвет тёмно-розовый FWM-002/Quartz pink,135.0
2019-01-15 10:00:00,69827,3d573784-59f3-49d3-b7ba-65a2e7d55f14,Скатерть Беатрис 50% полиэфир 50% хлопок прямоугольная 300х145 см светло-коричневая Wellness ML304-Беатрис*20,1724.0
2019-01-15 12:00:00,69828,ecefadc1-e7f3-4026-a5e7-1cf00195148b,Муляж Морковь 16 см,59.0
2019-01-15 12:00:00,69829,ecefadc1-e7f3-4026-a5e7-1cf00195148b,Муляж Баклажан 18 см,59.0
2019-01-15 13:00:00,69830,58a4c3cc-504f-43ea-a74a-bae19e665552,Простынь вафельная 200х180 см WELLNESS RW180-01 100% хлопок,47385.0
2019-01-15 21:00:00,69835,aa38e2e1-6da6-4f43-aa13-ed0210ea321c,Роза кустовая Ред Лейс 60 см Кения плантация Waridi Limited 10 штук в упаковке,2800.0
2019-01-16 08:00:00,69836,ef770989-4e4d-4f29-be2a-f7834846a483,Чехол для одежды Hausmann со стенкой из ПВХ и ручками 60х100 см AG,232.0
2019-01-16 10:00:00,69840,222db8e4-4107-4122-b691-5bcf53d2a9f5,Гладильная доска Dogrular Томрис 120x38 см,1649.0
2019-01-16 11:00:00,69846,63c441c2-7435-42c0-b359-b516f8bec40d,"Гладильная доска НИКА БЭЛЛЬ-ЮНИОР2 112х34,5 см БЮ2",749.0
2019-01-16 11:00:00,69842,f420bf6d-9985-47bc-95a7-5c640ad6d001,Муляж Зеленое яблоко полиуретан d-6 см,22.0
2019-01-16 14:00:00,69848,1aecd6cc-ad83-4136-9124-061918ffbd36,Полки QWERTY Лондон белый 27х27х10 см и 23х23х10 см 72000,1237.0
2019-01-16 15:00:00,69850,fb2f95f0-1f30-4e6a-a75c-92d1e2d341e3,"Сушилка для белья на батарею, СБ5-45, НИКА",134.0
2019-01-16 15:00:00,69851,fb2f95f0-1f30-4e6a-a75c-92d1e2d341e3,"Сушилка для белья на батарею, СБ5-45, НИКА",134.0
2019-01-16 15:00:00,69849,5518a551-5c26-466e-9c7a-335058203480,Тимьян d-9 см,112.0
2019-01-16 17:00:00,69855,0844991c-97be-4cbc-ba1a-af2eaaf896a2,Бульонница Luminarc МИСТИГРИ 500 мл J8770,328.0
2019-01-16 18:00:00,69856,465e0391-6992-45a9-97a8-c13ac43c165c,Сушилка для белья напольная НИКА СБП1/С 18 м,1198.0
2019-01-16 22:00:00,69857,9bb635d5-557c-442f-9dc7-9b2bd25a05f0,Нож для овощей и мяса (5024) 1518004,44.0
2019-01-17 01:00:00,69858,2ec87304-4a2e-49fb-9208-764e69c0a18d,Стремянка-табурет алюминиевая Hailo L90 Step-ke 4442-701 2х2 ступени,2699.0
2019-01-17 10:00:00,69861,595c636d-2625-494f-8c98-b342bd4fbb9f,Алоэ Вера d-12 см h-25 см,134.0
2019-01-17 19:00:00,69867,cabd0bde-ad05-47e2-90e7-3272061e2d3f,Коврик придверный Attribute NATURE кокосовый 60x40 см AMC015,382.0
2019-01-17 21:00:00,69868,c4c03d99-d2fa-4c46-861a-36e9ff268d97,Гладильная доска NIKA HAUSHALT Тефлон золотой 122х40 см HP1T/G,2699.0
2019-01-18 08:00:00,69869,f56005a0-cf94-4cce-a1ef-d22c1c7fe70c,"Жестяная банка Гуси 0,8 л 11х9,9 см Ц99h110v080-01339",312.0
2019-01-18 17:00:00,69872,8ddbc202-b360-4d9e-8684-2a053b85a092,Тележка багажная DELTA ТБР-20 коричневый с оранжевым грузоподъемность 25 кг сумка и 50 кг каркас РОССИЯ,727.0
2019-01-18 19:00:00,14525,baafdc94-c232-455e-ba15-174a0e97ae34,Пеларгония зональная диам. 12 см красно-розовая простая,188.0
2019-01-18 19:00:00,14525,baafdc94-c232-455e-ba15-174a0e97ae34,Пеларгония зональная диам. 12 см малиновая махровая,188.0
2019-01-18 19:00:00,14525,baafdc94-c232-455e-ba15-174a0e97ae34,Пеларгония зональная диам. 12 см розово-малиновая простая,188.0
2019-01-18 19:00:00,14525,baafdc94-c232-455e-ba15-174a0e97ae34,Пеларгония зональная диам. 12 см сиреневый полумахровый,188.0
2019-01-18 20:00:00,69873,cf2b0635-67bb-423b-85a4-a342c58bd1ca,Шеффлера Лузеана d-9 см,164.0
2019-01-18 22:00:00,69874,44fbc498-ec5a-4a18-b2ca-2764a36407f8,"Вешалка деревянная с расширенными плечиками и перекладиной 44,5х23 см см серый JAPANESE BLACK VALIANT JB-19708",1572.0
2019-01-19 05:00:00,69877,254dc363-45c6-4531-9986-86e04129bf20,"Комнатное растение в горшке Сциндапсус зеленый подвесной горшок, d15-16, h30",1794.0
2019-01-19 13:00:00,69881,88e4fd8b-c05c-4341-9368-291b452fee6b,Сушилка для белья напольная НИКА СБ3Б 10 м белая,569.0
2019-01-19 23:00:00,69883,4716c955-db54-4a8d-966a-a2190bdbd426,Роза одноголовая Родос 70 см Кения плантация Subati Flowers Limited 10 штук в упаковке,220.0
2019-01-20 17:00:00,69889,a5b92679-3a56-4ff6-afb9-8a847b8fc8b0,Сумка-тележка GIMI ITALO blue синяя,1574.0
2019-01-20 17:00:00,69888,e3922d65-542f-4c40-816d-eb9f739f569d,Корзина для белья ВИОЛЕТ с крышкой Ротанг 40 л латте 1840/20,487.0
2019-01-20 19:00:00,69890,3ca75ac4-68b2-4d83-99c9-1fdf74ce0575,Сушилка для белья напольная НИКА СБП1/С 18 м,599.0
2019-01-21 09:00:00,69893,8eabcaca-e8c8-4eee-9079-4ff5f612273a,Щетка для мытья посуды КОЛИБРИ М5202 большая,3400.0
2019-01-21 10:00:00,69898,8c4790d7-6eec-482e-9448-2cfcc1bec32f,Миксер ВАСИЛИСА ВА-506 белый с красным/малиновым 180 Вт 7 скоростных режимов,554.0
2019-01-21 11:00:00,69900,e0ff7e3f-4e3c-4e33-84ca-b84094f8a81c,Сушилка для белья напольная НИКА СБ3 10 м,569.0
2019-01-21 12:00:00,69901,c63870ee-dcc1-4b7d-ae76-520fe6a3fad6,Ключница Картина W-12 ЗАМОК 35х30 см,554.0
2019-01-21 15:00:00,69905,1afdf185-d45b-411b-a5fa-ef893dd39f5a,Разделочная доска Attribute GRANITE 20х30 см ABX111,374.0
2019-01-21 18:00:00,69908,6e9a859b-b863-43ec-8efb-6570bdb4ea5f,"Штора для ванной Spirella / Спирелла TEX Porto, белый, текстиль с гидрофобной пропиткой, 180*200 см, 1033938",2399.0
2019-01-21 19:00:00,69910,aedc8524-8611-4fb2-86ba-41ba82862bf6,Тарелка обеденная СТЕЛЛА ШОКОЛАД 25 см J1762 Luminarc,1302.0
2019-01-21 19:00:00,69909,c15e1560-2b6b-4e8f-8076-9bf7c3a06553,"Чайник электрический ВАСИЛИСА Т30-2000 нержавеющая сталь черный c красным 2000 Вт 1,8 л",689.0
2019-01-21 22:00:00,69912,803199fd-9cc6-4310-aa7c-83629fa867c6,Аптения d-12 см h-15 см,374.0
2019-01-22 10:00:00,69917,fd003d94-d728-49ca-9b6a-f17a43786d8a,"Герань домашняя (пеларгония зональная) цветущая D12, H25-30, розовая с малиновым, полумахровая",149.0
2019-01-22 11:00:00,69918,f6503cb7-d28a-4704-8495-c791bd702471,Мантоварка-пароварка WEBBER BE-81 нержавеющая сталь d=30 см,2219.0
2019-01-22 11:00:00,69920,95919727-3866-421f-8297-4f45348c3f33,Складная картонная коробка для хранения 30х20х15 см с уголками белый hm-9741-3 Hausmann,4272.0
2019-01-22 15:00:00,69928,6be74251-7159-4cc0-99fb-d034a17c61b0,Спатифиллум Шопен d-12 см,11250.0
2019-01-22 16:00:00,69932,9848d80a-6e76-4eb0-b382-1449cd67c385,Чехол для гладильной доски Colombo Клубки Пряжи Серый/Розовый 140х55 см из хлопка 5550,742.0
2019-01-22 22:00:00,69934,76593172-0856-4cae-8b43-51c1440b7f6b,Эхеверия Перл Фон Нюрнберг d-7 см,119.0
2019-01-23 07:00:00,14526,65750d7d-d0b4-46d1-83c2-f6756f0ab8a1,Пеларгония зональная диам. 12 см сиреневый полумахровый,188.0
2019-01-23 07:00:00,14526,65750d7d-d0b4-46d1-83c2-f6756f0ab8a1,Пеларгония зональная диам. 12 см сиреневый простая,188.0
2019-01-23 12:00:00,69939,e163be92-04cb-4859-a0f5-143ed106da73,Контейнер герметичный прямоугольный Виолет 092/051 500 мл дымчатый,74.0
2019-01-23 12:00:00,69940,e163be92-04cb-4859-a0f5-143ed106da73,Набор вешалок пластмассовых Rozenbal R181900,157.0
2019-01-23 13:00:00,14527,5fa9bbd0-f5b2-47e6-ad5d-a38c6e69c9b2,"Многолетнее растение Тимьян-чабрец розовый объем 0,5 л",89.0
2019-01-23 13:00:00,14527,5fa9bbd0-f5b2-47e6-ad5d-a38c6e69c9b2,Рассада зелени для кухни Розмарина в горшке диам. 9 см,101.0
2019-01-23 13:00:00,14527,5fa9bbd0-f5b2-47e6-ad5d-a38c6e69c9b2,Рассада зелени для кухни Шалфея в горшке диам. 9 см,101.0
2019-01-23 13:00:00,69941,b9b22b6a-5f2e-4f0c-8b2b-f54ff7f05238,Искусственный цветок пластиковый Нарцисс 3 бутона королевский 46 см,7.0
2019-01-23 14:00:00,69944,8fa1ee5d-7955-4ad6-8ce0-fd27033e991a,Емкость для соуса с ложкой PASABAHCE 200 мл OTS131505-000,1515.0
2019-01-23 14:00:00,69942,f29c5aa3-c50c-4558-a242-0569e03c32e1,Фикус каучуконосный Эластика Абиджан d-12 см h-30 см,164.0
2019-01-23 18:00:00,69946,3cc07fac-f7cc-44ed-b2c2-962d1c810aef,Тарелка суповая Luminarc МАРИСА ОРАНЖ 20 см J7687,1368.0
2019-01-23 21:00:00,69947,3f57fb59-15d6-4df5-bffe-217e7a0ad379,"Защитная соль для посудомоечных машин Ludwik 1,5 кг Польша 5900861242227",224.0
2019-01-24 10:00:00,69953,ea4043a9-1864-430a-9b4c-d8286915bf10,"Чехол для гладильной доски METAL 135х53 см, Attribute, ABM105",554.0
2019-01-24 11:00:00,69956,dfad9aa4-f5f7-4902-9e07-1dee83bc3506,"Таз пластмассовый 16,0 л пищевой круглый М2507, 1404037",1344.0
2019-01-24 15:00:00,69958,ac070679-0e88-4d63-af67-2277896d9451,"Гипоаллергенный концентрированный гель для стирки белья VPK для деликатных тканей 2,5 л Корея 8809473130144",539.0
2019-01-24 15:00:00,69959,eb9de5c6-a1be-4de6-a656-35947be6b203,"Коврик придверный с дизайном, из резины и кокоса 58,5*89 Gothic Iron Slice / Готический Узор, 4468",1642.0
2019-01-24 20:00:00,69962,6c38a2ac-1440-4edf-994d-c9f552714af9,Гладильная доска НИКА Бест 122х40 см НБ,1574.0
2019-01-25 09:00:00,69966,dae77d02-6c91-448a-bd8f-ce2b47b3c8ea,Муляж Ананас 21 см,374.0
2019-01-25 11:00:00,69968,c971fb21-d54c-4134-938f-16b62ee86d3b,Сиденье для ванны пластмассовое М1552 1714003,517.0
2019-01-25 15:00:00,69971,0f706ddb-69a1-4464-93e6-8b6c4f079f65,Скатерть 150х120 см WELLNESS WT125-Куэна 100% полиэстер,764.0
2019-01-26 09:00:00,69972,8eff5b5c-750a-4d7e-ac93-16e87fae5ba6,"Гладильная доска НИКА ДСП ЭКОНОМ 106,5х29 ЭК1",449.0
2019-01-26 15:00:00,69977,be1ed9d8-1e0c-46cb-afec-8162f7b13df8,Сумка-тележка 2-х колесная Gimi Argo черная,1087.0
2019-01-26 16:00:00,69978,5d04584e-4920-42ad-9f26-02a5c360feca,Коврик кухонный APACHE Coffee Chef 45x75 см 5420,2024.0
2019-01-26 21:00:00,69980,5d566073-92e8-41d1-a2e6-d301ee5ab6d8,Цветок искусственный Крокус 20 см,22.0
2019-01-26 21:00:00,69981,5d566073-92e8-41d1-a2e6-d301ee5ab6d8,Цветок искусственный Крокус 20 см,300.0
2019-01-26 22:00:00,69982,5d566073-92e8-41d1-a2e6-d301ee5ab6d8,"Декоративная композиция искуственных цветов Букет Роз три цветка, цвет в ассортименте 85 см",112.0
2019-01-27 11:00:00,69986,8cff7e6d-6875-44d0-9937-9b7d380faecd,Пеларгония зональная махровая микс d-12 см,209.0
2019-01-27 12:00:00,69987,004d24e9-4a6c-4d0e-8727-8391dfd4b43a,Вешалка-перекладина Valiant металлическая двойная с антискользящим покрытием 50320,1536.0
2019-01-27 15:00:00,69988,a0cfee58-2e99-47ae-9e57-aa1cfaaf70b0,Сушилка для белья Gimi Mito алюминий,1799.0
2019-01-27 16:00:00,69989,c51c51ee-7537-4319-8c77-b4420349b6df,Пеларгония зональная махровая микс d-12 см,627.0
2019-01-27 16:00:00,67497,ebaa2c16-1a52-48d1-bd2f-e590d8a957f9,"Скатерть Муза 100% полиэфир овальная 180х150 см сливочная с цветами, Wellness, WTO185-Муза*04",1012.0
2019-01-27 17:00:00,69990,002d4d3a-4a59-406b-86ec-c3314357e498,Сумка-тележка 2-х колесная складная Gimi Flexi серая,1649.0
2019-01-27 21:00:00,69992,b66305d1-9062-41a3-a4e0-1171ddac8d4e,Сушилка для белья потолочная ЛИАНА ЛЮКС 160 см ЛЛП-160,449.0
2019-01-27 23:00:00,69993,d54c2473-481a-41d6-8585-df6014d597f5,Кружка мерная 11600 1 л,67.0
2019-01-28 11:00:00,69995,c971fb21-d54c-4134-938f-16b62ee86d3b,"Штора для ванной Spirella / Спирелла TEX Rings, текстиль с гидрофобной пропиткой, серо-черный, 180*200 см, 1015184",2099.0
2019-01-28 12:00:00,69997,ed16f4d7-d6b3-4a9d-8821-f2ae3028f9f9,Сушилка для белья ЛИАНА ЛЮКС 110 см потолочная,389.0
2019-01-28 12:00:00,69996,c971fb21-d54c-4134-938f-16b62ee86d3b,Чехол для гладильной доски Colombo Persia Beige 130х50 см из хлопка 5379,674.0
2019-01-28 13:00:00,70001,859ff7b8-ec8c-4d6b-8c38-345788d8766f,"Герань домашняя (пеларгония зональная) цветущая D12, H25-30, лососевая, махровая",149.0
2019-01-28 13:00:00,70000,b2b00631-8a7a-4c61-8993-282b28ab3a6e,Роза Патио оранжевая d-12 см h-30,374.0
2019-01-28 13:00:00,69998,6362dd50-4d12-41a4-8534-44cb67c92ee3,Фиалка d-9 см белая махровая,119.0
2019-01-28 13:00:00,69999,f9a15108-149f-4b97-9888-2f0dd450cb06,"Герань домашняя (пеларгония зональная) цветущая D12, H25-30, красная, полумахровая",149.0
2019-01-28 14:00:00,70003,761cde26-1570-4263-8296-78e56cbd4772,"Измельчитель овощей ручной ШК-4 деревянный, 3 ножа, 1516020",1916.0
2019-01-28 17:00:00,70007,35a6aae3-9710-443c-b360-2cc3c6e2eef6,"Штора для ванной Spirella / Спирелла TEX Shine текстиль с гидрофобной пропиткой, шампань, 180*200 см, 1015640",4424.0
2019-01-28 21:00:00,70008,1f9af411-ce8f-4bb8-ba54-28c032df23eb,Гладильная доска НИКА BLUES 124х46 см 5757,2527.0
2019-01-28 22:00:00,70009,0a29b892-f32e-483a-871c-d05bb91bbb95,"Модульная стеклянная банка 1,1л, 298264, Brabantia,",5775.0
2019-01-28 22:00:00,70010,6c5b3e2b-719c-4af2-829c-98fe706a6fb8,Чехол Eurogold Clean Metallic металлизированый с поролоном для досок 120х38-120х42 см C42F3M,299.0
2019-01-28 23:00:00,70011,ca03ffbc-a53d-4d7d-99a8-dea92c8c88f0,Сушилка для белья Zalger Simfony 1255-90 одноуровневая с крыльями 20 м,1574.0
2019-01-29 10:00:00,70012,fc7d1f38-a8cd-47ab-8d5e-3d9cedcc05cd,"Контейнер для мусора пластиковый 50 л 40,7х30,6х72,7 см РОЛЛ ТОП серый, Curver, D 03977-856",1012.0
2019-01-29 10:00:00,70013,84a2542c-372e-43af-97f4-5990d6f626d0,Сушилка для белья настенная НИКА СН90 серебро 90 см,524.0
2019-01-29 12:00:00,70016,c971fb21-d54c-4134-938f-16b62ee86d3b,Сушилка для белья потолочная ЛИАНА ЛЮКС 200 см ЛЛП-200,487.0
2019-01-29 19:00:00,70017,fb242fe4-8eae-4767-8388-2838761b0967,Перчатки Fabrikators для чистки овощей детские оранжевый KO2PU,224.0
2019-01-29 21:00:00,70018,1cd0c18d-5437-400d-9a64-d0f8ba25f596,Термостакан WEBBER ВЕ-6031 ЧАЙ 450 мл,299.0
2019-01-30 10:00:00,70020,c971fb21-d54c-4134-938f-16b62ee86d3b,Сумка-тележка хозяйственная Rolser IMX001 negro Convert RG черная,4957.0
2019-01-30 12:00:00,70027,b5314f48-d92a-43d3-a021-2c4274ff2130,Штора для ванной комнаты 240х200 Fragmmento бежевая текстильная 240х200 см 6041,1162.0
2019-01-30 13:00:00,70028,395aeb0e-dab1-4dbd-8cbc-219ba2536e8a,Столовая ложка Attribute FORTRESS 2 шт ACF622,127.0
2019-01-30 15:00:00,70030,560083b4-f5a2-4a86-99c3-59e736915f42,Хлорофитум d-13 см,448.0
2019-01-30 15:00:00,70031,eec973c9-6ae9-4c1b-b1c7-a2718fde2f84,Муляж Красное яблоко мини полиуретан d-6 см,22.0
2019-01-30 19:00:00,70035,f5a5bf01-7180-4b07-bda7-13d34d879f45,Сушилка для белья Hausmann Hermes De Luxe 20 м 03-010C-1,3749.0
2019-01-30 19:00:00,70034,93b6c348-b9d8-46f5-b369-c88861af9dd3,Подставка для ножей ALPENKOK круглая из пластика 11*22 см красная AK-202ST,727.0
2019-01-30 22:00:00,70036,b27cb3a0-256a-4c99-acfd-1b68361490f4,Лестница стремянка ЗМИ Конёк медный антик ТС 277,974.0
2019-01-31 12:00:00,70041,052616d4-286c-4ae0-87ec-6d7f1c41f56f,Чайный набор Luminarc ЛИЛИ ФЛАУЭР 6 шт 320 мл J8565,1424.0
2019-01-31 14:00:00,70045,cc92a5b2-dea9-4b55-8a44-2bfa4ff44b08,Весы напольные Edition Feet механические,1424.0
2019-01-31 14:00:00,70043,c971fb21-d54c-4134-938f-16b62ee86d3b,"Петля рояльная цинк 960 мм, 1103055",74.0
2019-01-31 19:00:00,70048,a4c3dadb-eb3d-4ee1-81c5-1525e5ac2e20,"Банка стеклянная с металлической крышкой и краником Attribute GRAPE 3,8 л ABS038",667.0
2019-02-01 09:00:00,70050,ab46eafd-f9d3-4f91-af42-794d675d9c0c,Карниз для ванной комнаты Виолет раздвижной 210 см с кольцами белый 2110/6,157.0
2019-02-01 12:00:00,70053,c971fb21-d54c-4134-938f-16b62ee86d3b,"Чехол для гладильной доски I LOVE GIMI M из полиэстера и хлопка 132*48 см, Gimi",464.0
2019-02-01 12:00:00,70055,223c92c6-a951-4307-a8c3-19bdc455eb79,Азалия Индика фиолетовая d-10 см h-20,209.0
2019-02-01 15:00:00,70059,4b123350-0a74-43ab-b17a-c4ae4e4c9dde,Коврик хлопковый 45х75 см цвета в ассортименте 6195,635.0
2019-02-01 16:00:00,70060,c971fb21-d54c-4134-938f-16b62ee86d3b,"Сумка-тележка хозяйственная Andersen Scala Shopper Plus, Lini, синяя 133-108-90",5249.0
2019-02-01 19:00:00,70061,1f7d9fa8-2a19-4852-8d96-df314d02270f,Тележка багажная DELTA ТБР-20 черный с серым грузоподъемность 25 кг сумка 50 кг каркас РОССИЯ,727.0
2019-02-01 20:00:00,14529,e56f7220-5fb7-48ac-a606-03786df41343,Пеларгония зональная диам. 12 см темнорозовая полумахровая,188.0
2019-02-01 20:00:00,14529,e56f7220-5fb7-48ac-a606-03786df41343,Пеларгония зональная махровая белая,150.0
2019-02-01 20:00:00,14529,e56f7220-5fb7-48ac-a606-03786df41343,Пеларгония зональная махровая белая взрослое растение,150.0
2019-02-01 20:00:00,14529,e56f7220-5fb7-48ac-a606-03786df41343,Пеларгония розебудная Emma укорененный черенок,135.0
2019-02-01 20:00:00,14529,e56f7220-5fb7-48ac-a606-03786df41343,Пеларгония розебудная Mary укорененный черенок,135.0
2019-02-01 20:00:00,14529,e56f7220-5fb7-48ac-a606-03786df41343,Пеларгония розебудная Prins Nikolai укорененный черенок,135.0
2019-02-02 14:00:00,70065,7da2d0c1-eba4-4b4b-9b6a-d7276bce5c05,Тележка багажная DELTA ТБР-20 черный с серым грузоподъемность 25 кг сумка 50 кг каркас РОССИЯ,727.0
2019-02-02 17:00:00,70066,9b090857-e0bb-4bb6-b289-a402986601d7,Полки QWERTY Берлин чёрный 44х24х10 см 40х20х10 см 36х16х10 см 72008,3974.0
2019-02-02 18:00:00,70067,f0a8ceff-0220-4bcb-bac6-1f831eeb8677,"Штора для ванной комнаты ПВХ 180х180 см Ракушки бежевая, 5923",134.0
2019-02-03 16:00:00,70075,0a1b82ed-6fa9-486b-b358-4746f82f6e77,"Крючок проволочный 75 мм латунь, 1110136",44.0
2019-02-03 17:00:00,70076,e0ebcdf9-5839-4f8e-8881-4a2090e72f2b,Цветок искусственный Тюльпан 40 см пластик цвет в ассортименте,300.0
2019-02-03 18:00:00,70077,141797da-03db-40c4-a81d-62c1e4469a17,Сушилка для белья напольная НИКА СБП1/С 18 м,599.0
2019-02-03 19:00:00,70078,12eaa6c3-6a3d-4e39-89e8-df777a47d98c,"Герань домашняя (пеларгония зональная) цветущая D12, H25-30, лососевая, махровая",149.0
2019-02-03 20:00:00,70079,8b8d7154-b2d2-4000-81bf-fa1f6f913f3d,"Просеиватель для муки D27см., RSB",202.0
2019-02-04 06:00:00,70080,909564b8-3a5c-4d3e-8310-5ba1c837bbd7,Мусорный контейнер Hailo BigBin Swing 45 0845-010 45 л хром,16536.0
