date,order_id,customer_id,product,revenue
2019-07-24 16:00:00,72098,3a0c43c2-8886-43e6-b21c-60a23a21eb47,Сумка-тележка хозяйственная Gimi Easy Go синяя,1649.0
2019-07-25 09:00:00,72099,e303797d-9f33-49a4-b806-4d3dd3ed53d8,Корзина для белья ЭЛЬФПЛАСТ Paola 30 л бежевая 427беж,464.0
2019-07-25 11:00:00,72100,61d1d23e-085c-4725-9234-e7fc80b6adfb,"Отделитель косточек от вишен Leifheit, 37200",1649.0
2019-07-25 14:00:00,14908,3a7ddab1-066e-4cd9-909a-1d31900b396a,Пеларгония зональная диам. 12 см розовая с малиновым полумахровая,188.0
2019-07-25 14:00:00,14908,3a7ddab1-066e-4cd9-909a-1d31900b396a,Пеларгония зональная махровая лососевая,338.0
2019-07-25 14:00:00,14908,3a7ddab1-066e-4cd9-909a-1d31900b396a,Пеларгония зональная простая цвет фуксии взрослое растение,150.0
2019-07-25 14:00:00,72102,092c32d9-6f66-4e02-8e0b-5764c857a578,Корзина для белья ВИОЛЕТ с крышкой Ротанг 60 л белая 1860/06,592.0
2019-07-25 17:00:00,14909,e0cb2bf2-0b9a-4249-84f4-1b5d51435a4c,Пеларгония зональная диам. 12 см красная махровая,300.0
2019-07-25 17:00:00,14909,e0cb2bf2-0b9a-4249-84f4-1b5d51435a4c,Пеларгония зональная диам. 12 см красная полумахровая,300.0
2019-07-25 19:00:00,72105,058f7f22-4359-43c0-9931-98e2f390524a,"Термос со стеклянной колбой 1,0 л темно-зеленый 31003/12S",554.0
2019-07-25 21:00:00,72106,775755a7-5166-4528-8b34-0583c844d93c,Сумка-тележка 3-х колесная Gimi Tris Floral синяя,2699.0
2019-07-26 07:00:00,72107,b2cc8a72-4989-4aeb-8b12-41fa13dfd847,Сумка-тележка 2-х колесная Gimi Argo синяя,1087.0
2019-07-26 09:00:00,72108,04c9031f-1248-4fd9-add0-6c5a4efaa58e,Сушилка для белья напольная НИКА СБП1/С 18 м,599.0
2019-07-26 10:00:00,72109,f2ae382b-5682-4c9d-ac9b-f7264bd8190c,Чайник электрический DELTA DL-1329 нержавеющая сталь 2000 Вт 2 л,749.0
2019-07-26 13:00:00,72110,1c6c6981-6492-46a8-9c95-98c1d4130b71,"Сушилка для белья потолочная Лиана 1,7 м 1703006",562.0
2019-07-26 20:00:00,72114,b0500930-3155-46b7-893e-4e5fb194759b,Тележка багажная DELTA ТБР-23 грузоподъемность 50 кг РОССИЯ,638.0
2019-07-27 00:00:00,72115,fbafa598-bc5e-448d-baf8-92fbe38c4cb7,Пеларгония розебудная Red Pandora укорененный черенок,134.0
2019-07-27 09:00:00,72116,45ba394d-9104-4b58-bd45-7e3061617dfc,Сумка-тележка 2-х колесная Gimi Argo красная,1087.0
2019-07-27 10:00:00,72117,25943c17-5df2-437b-80f8-2413ddf90172,Тележка багажная DELTA ТБР-20 синий грузоподъемность 25 кг сумка и 50 кг каркас РОССИЯ,734.0
2019-07-27 20:00:00,72119,d070605c-c636-41aa-bdfb-306221120778,Чехол для гладильной доски с дизайном Mаrylin Monroe 130х50 см из хлопка,674.0
2019-07-27 21:00:00,14910,4d9af62e-7f3b-40a7-9a07-bb547e6892dc,Пеларгония зональная диам. 12 см сиреневый полумахровый,150.0
2019-07-27 21:00:00,14910,4d9af62e-7f3b-40a7-9a07-bb547e6892dc,Пеларгония зональная диам. 12 см сиреневый простая,150.0
2019-07-27 21:00:00,14910,4d9af62e-7f3b-40a7-9a07-bb547e6892dc,Пеларгония розебудная Prins Nikolai укорененный черенок,135.0
2019-07-27 21:00:00,14910,4d9af62e-7f3b-40a7-9a07-bb547e6892dc,Пеларгония розебудная Queen Ingrid укорененный черенок,135.0
2019-07-27 21:00:00,14910,4d9af62e-7f3b-40a7-9a07-bb547e6892dc,Пеларгония розебудная Red Pandora укорененный черенок,135.0
2019-07-27 21:00:00,14910,4d9af62e-7f3b-40a7-9a07-bb547e6892dc,Пеларгония тюльпановидная EMMA,135.0
2019-07-28 13:00:00,72123,a7985efd-df3d-4040-a832-10291bc631f0,Сумка-тележка 3-х колесная Gimi Tris черная,1800.0
2019-07-28 14:00:00,72125,6b0c6cfb-7717-4c34-8535-bbc6e2b2c758,Муляж Красное яблоко мини полиуретан d-5 см,242.0
2019-07-28 14:00:00,72124,09521bde-42aa-482f-a92d-cf82b082bc82,"Муляж Долька Арбуза 14*7,5 см",118.0
2019-07-28 15:00:00,72128,b489b9f0-03c0-45f0-aa16-6c46ce831228,"Нож поварской ALPENKOK из циркониевой керамики 15,2 см красный АК-2062К",1101.0
2019-07-28 15:00:00,72126,6b0c6cfb-7717-4c34-8535-bbc6e2b2c758,Муляж Оранжевое яблоко мини полиуретан d-5 см,198.0
2019-07-28 15:00:00,72127,6b0c6cfb-7717-4c34-8535-bbc6e2b2c758,Муляж Желудь 2 шт,220.0
2019-07-28 19:00:00,72129,0bf6588a-d843-4099-b8d9-251748b03fa5,"Полотенце прессованное P46 Авто_2, 100% хлопок 278 г/м2, 30х60 см, Wellness, 4607101069064",89.0
2019-07-29 00:00:00,72130,60c37d43-7d83-4220-adcc-67c9a7d254bc,Коврик кухонный APACHE Olive Oil Sideboard 56х86 см 5062,1447.0
2019-07-29 07:00:00,72132,f6ced393-47d8-4135-9295-9c2e520b8c5c,"Щетка-сметка 3-х рядная деревянная 450 мм (плоская ручка), Поиск Риф 1810064",52.0
2019-07-29 07:00:00,72133,70b5d46f-1ee0-404d-824e-31223a6eed0b,Базилик Пурпурные Звезды d-7 см,42.0
2019-07-29 09:00:00,72134,e323e5c3-7b2c-4558-8e76-34698e0b2946,"Весы электронные кухонные Soehnle (круглые,20 см. стеклянные) серебро 5кг/1гр. 66161",1274.0
2019-07-29 12:00:00,72135,b622b447-ee4e-4150-b879-e2cd3faa6469,Штора для ванной комнаты 240х200 Sintra бежевая текстильная 240х200 см 6039,1162.0
2019-07-29 17:00:00,72139,0d87f4ae-465a-4fac-81e6-5d629761783e,Сушилка уличная Leifheit 85210 LINOMATIC V 400 40 м 175х237х237 см зеленая,14917.0
2019-07-30 01:00:00,72140,e2fe6b48-1955-4882-925c-733f545df026,Сумка-тележка хозяйственная Rolser MNB017 fucsia LOGIC DOS+2 фуксия,7679.0
2019-07-30 03:00:00,72141,44931b1a-3587-4d7a-b680-6b25092fcdb6,Сушилка для белья настенная Zalger Prima 510-720 веревочная 7 линий 25 м,150.0
2019-07-30 04:00:00,72142,44931b1a-3587-4d7a-b680-6b25092fcdb6,Сушилка для белья настенная Zalger Prima 510-720 веревочная 7 линий 25 м,150.0
2019-07-30 17:00:00,72149,b0500930-3155-46b7-893e-4e5fb194759b,Тележка багажная DELTA ТБР-23 грузоподъемность 50 кг РОССИЯ,1124.0
2019-07-30 19:00:00,72150,ee6c711e-dd36-4ebd-8b33-600ce22eeb40,Чехол для гладильной доски Zalger 520116 130х46 см хлопок для доски 125х42 см,149.0
2019-07-30 20:00:00,72151,5a557a54-026f-43d3-8e5b-477a35ee88ca,"Измерительный угольник, длина 15 см, Truper, ECT-6/14369",449.0
2019-07-30 21:00:00,72152,909dd026-13b8-4f10-9dc6-cd3586dffbcf,"Таз пластмассовый 30,0 л овальный ПЦ2913, 1404051",404.0
2019-07-31 07:00:00,72153,2d51b277-cb8a-48eb-bdbf-b3315276f01a,"Сумка-тележка хозяйственная Andersen Scala Shopper Plus, Hava, синяя 133-103-90",7199.0
2019-07-31 13:00:00,72159,6ee13c13-fa55-4f2f-8e7f-3835d69d9644,"Набор для пикника Полимербыт на 4 персоны контейнер 6,5 л 22 предмета 4380940",1648.0
2019-07-31 14:00:00,72161,ec8029ce-0f30-49b3-b626-b5976799b049,Штора для ванной комнаты Bacchetta Fragmmento бежевая текстильная 180х200 см 6034,974.0
2019-07-31 16:00:00,72162,794e66f5-4d30-4860-b44c-903c9f58127f,Спатифиллум Свит Лауретта d-21 см h-95 см,88.0
2019-08-01 07:00:00,72164,f0054c60-0290-4608-b04f-84778d144bcd,Сушилка для белья потолочная Zalger Lift Basic 1520 200 см 10 м,614.0
2019-08-01 09:00:00,72165,ae6b33e8-c614-4947-a49d-5158d37e6a8c,Коврик придверный PHP SRL 40х68 см Format Forme 21719 Пиано 6009,899.0
2019-08-01 10:00:00,72169,f005fb00-eafb-4f7e-8b45-9e700cc0fc8e,Фиалка махровая голубая d-12 см,247.0
2019-08-01 10:00:00,72168,bf969368-ffae-40a0-89e1-cc88f4a3100b,Мята Махито Japanosche Mojito Minze d-7 см h-10 см укорененный черенок,74.0
2019-08-01 11:00:00,72170,5bbd2c0c-d93f-4ffe-b08c-0267dd881317,Гладильная доска НИКА BLUES 124х46 см 5757,2527.0
2019-08-01 17:00:00,72173,f259bd49-11b0-49e3-a605-365f21431f82,"Шпагат полипропиленовый 1.2 ктекс 110 м *Ками Груп*, 1201104",44.0
2019-08-01 21:00:00,72177,843a7a49-5965-4336-b73e-46cbf92c2b41,Шприц кондитерский WEBBER с 8 насадками 23*10*6 см ВЕ-0331,97.0
2019-08-01 22:00:00,14911,0df1ac82-eb64-48d3-85d8-3d042202a765,Рассада зелени для кухни Лаванда Блю Райдер диам. 9 см,120.0
2019-08-01 22:00:00,14911,0df1ac82-eb64-48d3-85d8-3d042202a765,Рассада зелени для кухни Лаванды в горшке диам. 9 см,120.0
2019-08-01 22:00:00,14911,0df1ac82-eb64-48d3-85d8-3d042202a765,Рассада зелени для кухни Розмарин Блю Лагун диам. 9 см,120.0
2019-08-01 22:00:00,14911,0df1ac82-eb64-48d3-85d8-3d042202a765,Рассада зелени для кухни Розмарина в горшке диам. 9 см,120.0
2019-08-01 22:00:00,14911,0df1ac82-eb64-48d3-85d8-3d042202a765,Рассада пряной травы Кофе Арабика в горшке d-9 см,30.0
2019-08-01 22:00:00,72179,4991c534-1df2-48eb-a044-dd3d428d92df,Крышка оцинкованная для стерилизации банок (на 3 банки) 1514008,82.0
2019-08-01 23:00:00,72180,f9e72f43-d525-4e79-bb4a-26e44bfc7022,Мирт d-20 см h-25 см,337.0
2019-08-02 09:00:00,72183,d5f7436a-7a3e-4422-8fd5-a58045c5f5b7,"Банка РОНДО ВАЛЕНСИЯ 1л, G8494, Luminarc, Китай",745.0
2019-08-02 19:00:00,72189,030c91b7-311d-407e-a3ac-e64c03537569,Тележка хозяйственная багажная D-T101 грузоподъемность 25кг,150.0
2019-08-02 20:00:00,72190,126dac4d-6486-49ed-a1be-9fd55a38a9de,"Сумка-тележка хозяйственная Andersen Scala Shopper, Lini, синяя 112-108-90",4574.0
2019-08-03 15:00:00,72193,37294961-81ad-4d75-a62d-2f96d9a99f27,Корзина для белья Виолет Ротанг 2350/2 угловая с крышкой 60 л бежевая,599.0
2019-08-03 15:00:00,72194,e606bc6c-c33d-4910-a388-704ba8cfe04b,Импатиенс Нью Гвинея микс d-12 см,254.0
2019-08-03 17:00:00,72195,65fe3177-3007-43fc-ab11-a13f9a31815f,Сумка-тележка 2-х колесная Gimi Argo синяя,1087.0
2019-08-03 19:00:00,72196,329787bc-919c-4850-9cae-eaf3f909fd6e,Жестяная банка Гуси П67*98h98v060-01338,97.0
2019-08-03 20:00:00,72197,fc736e7c-c505-4467-8437-f83a4a131f92,"Сумка-тележка хозяйственная Welfull Daisy, черная 100-002-80",1087.0
2019-08-03 22:00:00,72198,71b64fbc-4b00-4f9a-8cdc-8632d6aff974,Сумка-тележка хозяйственная GIMI ROLLING THERMO синяя,2025.0
2019-08-04 10:00:00,72200,6c4cb43f-ae80-41aa-827d-0f569d7afbd7,Пеларгония розебудная Queen Ingrid укорененный черенок,402.0
2019-08-04 11:00:00,72201,6f977064-ebcb-45d0-9115-4c641341fcc8,Корзина для белья ВИОЛЕТ с крышкой Ротанг 60 л белая 1860/06,592.0
2019-08-04 14:00:00,72202,e11babfa-0246-416f-ba39-a1941439b36e,"Чехол для гладильной доски Leifheit Cotton Classic L 135х45 см на защелке, 72322",1177.0
2019-08-04 16:00:00,72204,876e2d08-bc93-4b66-87aa-43afeb7460c5,Сумка-тележка 2-х колесная Gimi Galaxy красная,2774.0
2019-08-04 18:00:00,72205,f3989c30-209b-4961-b640-190d726dc4ba,Пеларгония розебудная Queen Ingrid укорененный черенок,134.0
2019-08-04 20:00:00,72206,e6a05cb8-8c26-4529-824e-953b62e9b5de,Скатерть Dasch Донна Роза из ПВХ 0401-2 Розы круглая 152 см 5974,442.0
2019-08-04 23:00:00,14912,5c265590-edb1-4ba7-84e1-48ccf5c9e703,"Рассада зелени для кухни Мелисса лимонная зеленый объем 0,75 л",89.0
2019-08-04 23:00:00,14912,5c265590-edb1-4ba7-84e1-48ccf5c9e703,Рассада зелени для кухни Тимьян Вариегэйтид диам. 9 см,840.0
2019-08-05 10:00:00,72209,d10d338f-6871-49d4-a253-7f35da6a6867,Коврик хлопковый 40х60 см цвета в ассортименте 6194,97.0
2019-08-05 10:00:00,72208,3528c422-619e-4e6d-b654-5bbc84124c73,Сушилка для белья Hausmann Asteria 9 м 100101,1499.0
2019-08-05 11:00:00,72210,76615b86-9e6a-47d9-a98d-989b3e15e6e7,"Щетка хозяйственная с резинкой из синтетического каучука и пластика POWERSLIDE 40х20 см голубая, Leifheit, 51520",734.0
2019-08-05 11:00:00,72211,7adbb583-cfcb-430d-9f88-808f8ed64aa6,Сумка-тележка 3-х колесная Gimi Tris Floral синяя,2699.0
2019-08-05 13:00:00,72212,24f2c305-bb75-4169-abbf-c874bfbe0e90,Пеларгония розебудная Prins Nikolai укорененный черенок,134.0
2019-08-05 14:00:00,72214,17a27863-69ce-4920-b2b7-4adc643078fa,"Таз пластмассовый 16,0 л пищевой овальный с ручками С125, 1404040",224.0
2019-08-05 16:00:00,72216,c3d05e26-b97a-4b28-92a8-8533b72e3875,Мята перечная Шоколадная Chocolate d-7 см h-10 см укорененный черенок,74.0
2019-08-05 17:00:00,72217,42c8e1f3-011e-49d8-a415-feedd60335ee,"Сумка-тележка хозяйственная багажная D-Т125 красная грузоподъемность 30кг,",1162.0
2019-08-06 07:00:00,72218,72efabc6-66cb-493f-84ef-bf6476f0ee22,"Покрытие для гладильной доски Airboard M Premium Speed , 125х40 см, Leifneit, арт. 72373",1612.0
2019-08-06 08:00:00,14913,05c2f18a-6c9d-4fe1-a18b-b575c9f3e1d5,"Клен ложноплатановый Леопольди в горшке 3,5 л",420.0
2019-08-06 10:00:00,72219,59d715ca-dcd8-4404-a765-78e2a36f26ce,Хлебница пластмасовая большая 5.0 л Р1673 1524004,524.0
2019-08-06 11:00:00,72220,a0ce9b81-dad7-48f6-a28a-bb671c05166f,Чайная ложка TRENDY сталь 2 мм 3 шт Attribute ACT033,1204.0
2019-08-06 16:00:00,72223,4567957f-1bbc-469d-aa2e-44a514092b3d,Бальзамин новогвинейский d-13 см белый с розовым цвет фуксии с белыми вкраплениями,134.0
2019-08-06 20:00:00,72225,8b2b91ad-735a-40c3-ab0f-2e731b449090,"Штора для ванной комнаты Cannetto 240х200 см коричневая, Bacchetta, 4061",1199.0
2019-08-06 21:00:00,72227,7488ed43-43a3-4251-9606-27ab0240dc39,Штора для ванной комнаты 240х200 Fragmmento бежевая текстильная 240х200 см 6041,1162.0
2019-08-07 10:00:00,72228,3852da56-ceaa-4b00-aa25-cac360c90e37,Пеларгония зональная Мультиблум Скарлет Ай d-7 см h-10 см укорененный черенок,74.0
2019-08-07 11:00:00,72229,52ca850d-ce65-4445-bddc-b0b063b13ba7,Салатник Luminarc КУТЮР 27 см H3529,299.0
2019-08-07 13:00:00,72230,da931437-d623-480b-b2ce-4d6ec1a395f6,Муляж Оранжевое яблоко мини полиуретан d-5 см,440.0
2019-08-07 13:00:00,72231,acfea398-3a45-4a7c-b417-4cd5db41321e,Пеларгония розебудная Red Pandora укорененный черенок,268.0
2019-08-07 18:00:00,72232,f9c9c7a8-fb51-40e3-b613-4465b6716fd4,Гладильная доска НИКА Бест 122х40 см НБ,1125.0
2019-08-08 08:00:00,72233,a16e499f-f295-4b6c-b846-aeed6477eb70,"Полка для обуви Hausmann 3 яруса 60х24,3х60 см сосна HM-3013",1874.0
2019-08-08 09:00:00,72235,6c54c598-5944-4ccb-a05e-161ddc7b1045,"Коврик придверный хлопковый 60х140 см мультиколор, Helex, С04",1108.0
2019-08-08 15:00:00,72237,bda93087-10e7-4960-a779-4c809983a387,Тележка багажная DELTA DT-23 грузоподъемность 50 кг РОССИЯ,1124.0
2019-08-08 20:00:00,72240,64cf94ab-c9a0-4a5b-a701-34a9cf65f4e0,"Сушилка для белья потолочная Лиана 1,3 м 1703002",509.0
2019-08-09 21:00:00,72249,94f56c09-b310-48fa-890a-ae15846558c5,Сумка-тележка хозяйственная Gimi Easy Go красная,1050.0
2019-08-09 23:00:00,72250,a93c4a22-ada7-4c90-b884-f8ea72ccda22,"Термос со стеклянной колбой 0,8л 21008",300.0
2019-08-10 06:00:00,72252,89a75949-783a-472a-afa6-4977103bfebe,Подкладка под чехол Zalger 520114 135х50 см войлок,127.0
2019-08-11 20:00:00,72256,e9e84a33-7944-4eef-b7d5-a3b11138aefc,Спатифиллум d-7 см,116.0
2019-08-11 22:00:00,72258,b17d36a6-13b0-4896-815f-45ee6adfd23d,Пеларгония розебудная Red Pandora укорененный черенок,134.0
2019-08-12 12:00:00,72262,9c3b210c-9410-4252-8b4a-974e68f2afa7,Тележка хозяйственная Gimi Atos,1087.0
2019-08-12 13:00:00,72264,a40944fa-3589-4dd5-8611-291de246850a,Коврик хлопковый 40х60 см цвета в ассортименте 6194,582.0
2019-08-12 14:00:00,72266,e3d9fed0-3656-420b-a637-0b17653dfabe,"Веревка полипропиленовая (фал) d-4 мм, L-20 м, 1201031",208.0
2019-08-12 16:00:00,72267,799b66e1-a47e-4143-8167-8bf434651e83,Искусственный цветок Роза открытая малая пластиковая красная,116.0
2019-08-12 17:00:00,72268,8ff2202e-e732-47b4-8cd5-d0ff5761d47c,"Миска для варенья алюминиевая с крышкой, 36 см, SСOVO, ДЕМ МТ-037, /1502083",787.0
2019-08-12 21:00:00,72269,03427797-398e-497d-a303-48879e7ba7f7,"Тележка хозяйственная складная, ТХ0253, 50 кг, Пэмби",525.0
2019-08-13 06:00:00,72272,51326673-aba0-4c96-83e7-7792ef023b51,Тележка багажная DELTA DT-22 синий грузоподъемность 20 кг сумка и 50 кг каркас РОССИЯ,674.0
2019-08-13 08:00:00,72274,019ddfb4-f9fe-4b17-88bb-0ec9edb56479,"Сумка-тележка TWIN стальной каркас 56 л серая, Gimi",2549.0
2019-08-13 10:00:00,72276,a688224b-38c6-4fab-9d0e-f9c7b0ac6d13,"Штора для ванной Spirella / Спирелла Peva Hugo, синий, полиэтилен, 180*200 см, 1001951",975.0
2019-08-13 10:00:00,72275,b18c373d-fcb4-4d14-8425-f26f21f52158,"Таз пластмассовый 30,0 л овальный ПЦ2913, 1404051",404.0
2019-08-13 15:00:00,72279,358cf69a-2366-48e3-9c33-c822661f7d43,"Мешок для строительного мусора 95х55 см, зеленый 1803003",1.0
2019-08-13 17:00:00,72281,ec964a80-31f3-4411-a468-6e33cb417f15,Пеларгония розебудная Red Pandora укорененный черенок,134.0
2019-08-14 02:00:00,72283,87adc8b2-dd12-448e-bc8a-5435923d9caf,Сушилка для белья на ванну НИКА СБ4,449.0
2019-08-14 04:00:00,72284,f0a8e283-c872-4f2d-9e4b-966238a3d2ca,Сушилка для белья на стену Leifheit TELEFIX/TELEGANT 100,3674.0
2019-08-14 13:00:00,72286,6d27f0da-201b-4630-8678-c6abcf90eaa7,"Таз пластмассовый строительный прямоугольный 80 л, 1404085",524.0
2019-08-14 16:00:00,72293,655023da-de7f-48fc-aaab-029060c9519a,Сумка-тележка 3-х колесная Gimi Tris Floral синяя,2699.0
2019-08-14 21:00:00,72294,5f2e0a31-aa23-4850-8e26-b41a14fbe196,Чехол для гладильной доски Colombo Persia Beige 130х50 см из хлопка 5379,674.0
2019-08-15 08:00:00,72296,d5f1b5eb-f47d-4849-89e4-8d57bd8a4cde,Сумка-тележка хозяйственная Rolser JEA021 rojo Convert красная,3562.0
2019-08-15 08:00:00,72295,87b754ae-0f9f-4bbf-8769-9117d6ecf109,Вешалка - слуга Малая ЗМИ белое серебро ВНП 141 б,577.0
2019-08-15 09:00:00,72297,e7833283-956b-43f0-9a2b-0b71e229c1a1,Коврик влаговпитывающий ребристый 60х90 см Стандарт черный 5881,838.0
2019-08-15 13:00:00,72300,ecc69147-1112-4c17-a573-cf1c3a42e83d,"Овощеварка алюминиевая Scovo МТ-045, Хозлэнд, 1502079",449.0
2019-08-15 13:00:00,72302,16e422c6-94fe-4ccf-9c97-05493f3e99c4,Набор инструментов в алюминиевом кейсе на колесиках с ручкой КУЗЬМИЧ 187 предметов НИК-001/187,5399.0
2019-08-15 17:00:00,72303,a592fbef-dd62-4069-9e77-9043101b6077,"Ткань для гигиенических поверхностей (для чистки и впитывания с антибактериальным покрытием) 400*400 мм, Leifheit, 40000",564.0
2019-08-15 23:00:00,14917,9988a59f-f1ec-4f0c-bb3e-cd0e235ad15e,"Вербена крупноцветковая White белая объем 0,5 л",90.0
2019-08-15 23:00:00,14917,9988a59f-f1ec-4f0c-bb3e-cd0e235ad15e,Пеларгония зональная диам. 12 см розовая полумахровая,376.0
2019-08-15 23:00:00,14917,9988a59f-f1ec-4f0c-bb3e-cd0e235ad15e,Пеларгония зональная махровая лососевая,752.0
2019-08-15 23:00:00,14917,9988a59f-f1ec-4f0c-bb3e-cd0e235ad15e,Пеларгония розебудная Mary укорененный черенок,270.0
2019-08-15 23:00:00,14917,9988a59f-f1ec-4f0c-bb3e-cd0e235ad15e,Пеларгония розебудная Prins Nikolai укорененный черенок,270.0
2019-08-15 23:00:00,14917,9988a59f-f1ec-4f0c-bb3e-cd0e235ad15e,Пеларгония розебудная Queen Ingrid укорененный черенок,270.0
2019-08-15 23:00:00,14917,9988a59f-f1ec-4f0c-bb3e-cd0e235ad15e,Пеларгония тюльпановидная EMMA,540.0
2019-08-15 23:00:00,14917,9988a59f-f1ec-4f0c-bb3e-cd0e235ad15e,"Петуния Surfinia Doble White белая махровая объем 0,5 л",90.0
2019-08-16 02:00:00,72306,2eef43dd-ad75-4e55-a46d-edea403bcb6b,Tepмокружка AVEX Freeflow 700 мл сталь AVEX0776,2399.0
2019-08-16 07:00:00,72307,0131d2f9-e553-4cb6-ac85-f96e9cb7cb47,"Сушилка для белья на стену Leifheit Rollquick до 4.2 м, белая, 83006",1574.0
2019-08-16 11:00:00,72310,0d63e933-a9e7-4286-885e-f114b0ab43c2,Замиокулькас d-15 см h-30 см,472.0
2019-08-16 12:00:00,14918,2651a46e-d4b9-406c-95c1-566c16e8d164,Декабрист в горшке D12 красный,139.0
2019-08-16 12:00:00,14918,2651a46e-d4b9-406c-95c1-566c16e8d164,Пеларгония розебудная Prins Nikolai укорененный черенок,135.0
2019-08-16 12:00:00,14918,2651a46e-d4b9-406c-95c1-566c16e8d164,Пеларгония розебудная Red Pandora укорененный черенок,135.0
2019-08-16 12:00:00,14918,2651a46e-d4b9-406c-95c1-566c16e8d164,Пеларгония розебудная Rosebud Red d-7 см,135.0
2019-08-16 12:00:00,72311,5355b468-091c-46f8-af2b-2c4c70215359,Каланхое каландива желтое d-7 см,635.0
2019-08-16 13:00:00,72312,5d9a3164-38fd-41f0-8e05-878e4c1d591e,Отбеливатель Пероксоль Лилия-М 100 гр Россия 4670008040078,370.0
2019-08-16 16:00:00,72315,4b221d0f-3bc3-4c5b-ac7e-d57b360355d1,"Сахарница фарфоровая LAVENDER BLADE 10 см, Domenik, DM9247",172.0
2019-08-16 16:00:00,72313,ff601403-b094-4b86-9ac6-264d725b9277,Сумка-тележка 2-х колесная складная Gimi Flexi зеленая,1649.0
2019-08-16 23:00:00,72320,be84bbc4-812f-44f6-ba9b-0386cd8648f2,"Коврик придверный MOHAWK Mansonry Foliage Листопад 58,5х89 см 5412",1649.0
2019-08-17 10:00:00,72321,79e65126-3b66-4822-a1a1-d915b14070a5,Пеларгония розебудная Prins Nikolai укорененный черенок,134.0
2019-08-17 14:00:00,72322,87877089-61c3-4143-8f59-9b0a3f4f4154,Тележка багажная DELTA ТБР-20 коричневый с оранжевым грузоподъемность 25 кг сумка и 50 кг каркас РОССИЯ,750.0
2019-08-17 15:00:00,72323,648a9e74-c254-45f4-9f80-f551dbe6fe22,"Бидон пластмассовый 5,0 л (Иж) 1401119",284.0
2019-08-17 17:00:00,72325,e9e07501-03fe-4d45-af18-d6e7fa9786dc,Тележка багажная DELTA ТБР-20 черный с серым грузоподъемность 25 кг сумка 50 кг каркас РОССИЯ,734.0
2019-08-18 01:00:00,72327,35834d1a-382e-406e-b70c-26a7e9061f63,"Таз пластмассовый со стиральной доской (Иж), 1404021",195.0
2019-08-18 10:00:00,72329,540072bd-cc85-43b5-a6d6-0a8720499e65,Стремянка COLOMBO FACTOTUM 4 ступени алюминий G110AT4W,3449.0
