date,order_id,customer_id,product,revenue
2019-04-25 19:00:00,14694,059d1900-8450-47b0-b914-e5744cea5017,Пеларгония розебудная Rosebud Red d-7 см,135.0
2019-04-25 19:00:00,14694,059d1900-8450-47b0-b914-e5744cea5017,Пеларгония Toscana Angeleyes Amarillo Burgundy укорененный черенок,112.0
2019-04-25 19:00:00,14694,059d1900-8450-47b0-b914-e5744cea5017,"Петуния Surfinia Doble Lilac светло-сиреневая махровая объем 0,5 л",90.0
2019-04-25 19:00:00,14694,059d1900-8450-47b0-b914-e5744cea5017,"Петуния Surprice Yellow желтая с прожилками объем 0,5 л",90.0
2019-04-25 19:00:00,14694,059d1900-8450-47b0-b914-e5744cea5017,"Петуния Surprise Magenta Halo малиново-белая объем 0,5 л",90.0
2019-04-25 19:00:00,14694,059d1900-8450-47b0-b914-e5744cea5017,"Петуния Sweetunia Black Satin черная объем 0,5 л",90.0
2019-04-26 06:00:00,71284,34066615-a1ae-48e1-a88d-2c516766d08e,"Декоративная композиция искуственных цветов Букет Пионов три цветка, цвет в ассортименте 80 см",896.0
2019-04-26 10:00:00,14695,f7e11f53-18cc-4699-8da5-1d5c5e47349b,"Калибрахоа ампельная, диам. 12 см",142.0
2019-04-26 10:00:00,14695,f7e11f53-18cc-4699-8da5-1d5c5e47349b,"Пеларгония плющелистная ампельная, диам. 12 см",142.0
2019-04-26 10:00:00,14695,f7e11f53-18cc-4699-8da5-1d5c5e47349b,Петуния изи вейв рассада однолетних цветов в горшке диам. 12 см,142.0
2019-04-26 11:00:00,71287,beb2ddb4-aea4-4128-94c9-f88eb71c6a05,Ведро для ягод Полимербыт 2 л 4311001,472.0
2019-04-26 11:00:00,71288,beb2ddb4-aea4-4128-94c9-f88eb71c6a05,Ведро для ягод Полимербыт 2 л 4311001,472.0
2019-04-26 11:00:00,71289,ebbfdb82-296e-4b04-9a44-e57ef107b4df,Окномойка с пластмассовой ручкой 42 см щетка 21 см разборная 57575 1804050,217.0
2019-04-26 12:00:00,14696,9fbf7c33-e563-4475-a9dc-0eb06fe1a3a4,"Однолетнее растение Петуния махровая в кассете 4 шт, Россия",2050.0
2019-04-26 12:00:00,71291,44bb4a43-82ac-4c3c-b753-28c793ea9079,Коврик противоскользящий кружевной 88х38 см голубой 5527,217.0
2019-04-26 14:00:00,14697,7e472253-66b6-4b16-abde-448d6531d319,"Рассада зелени для кухни Мелисса лимонная зеленый объем 0,75 л",89.0
2019-04-26 14:00:00,14697,7e472253-66b6-4b16-abde-448d6531d319,Рассада зелени для кухни Мята Морокан диам. 9 см,120.0
2019-04-26 14:00:00,71294,8f00cdbf-0de2-4bad-a84f-e437ba684f30,"Чехол Eurogold Clean Premium хлопок, поролон, для досок 110х30-114x34 см C34F3",217.0
2019-04-26 20:00:00,71299,d2b6f3f3-01dc-4152-b208-609c3f203626,Мускари White Magic в горшке d-10 см 7 луковиц,127.0
2019-04-26 21:00:00,71300,8cf3c949-8d92-40ad-a5fa-d67a4b49456d,Коврик Dasch для ванной комнаты 50х80 см HJ-C 1119 Милена коричневый 5820,637.0
2019-04-26 22:00:00,71301,3518a0d5-7634-45e9-a810-d4e228abe5d9,Сумка-тележка 2-х колесная Gimi Argo синяя,1087.0
2019-04-26 22:00:00,71302,3518a0d5-7634-45e9-a810-d4e228abe5d9,Сумка-тележка 2-х колесная Gimi Argo синяя,1087.0
2019-04-27 16:00:00,14698,d3b9ffea-d143-4747-8d59-74ab843d1ad6,Земляника садовая Хоней d-9 см P9,75.0
2019-04-27 16:00:00,14698,d3b9ffea-d143-4747-8d59-74ab843d1ad6,"Колокольчик персиколистный белый объем 0,5 л",105.0
2019-04-27 16:00:00,14698,d3b9ffea-d143-4747-8d59-74ab843d1ad6,Пиретрум Робинсон красный объем 1 л,112.0
2019-04-27 16:00:00,14698,d3b9ffea-d143-4747-8d59-74ab843d1ad6,Рассада зелени для кухни Лаванда Блю Райдер диам. 9 см,120.0
2019-04-27 16:00:00,14698,d3b9ffea-d143-4747-8d59-74ab843d1ad6,Рассада зелени для кухни Лаванда Прованc диам. 9 см,120.0
2019-04-27 16:00:00,14698,d3b9ffea-d143-4747-8d59-74ab843d1ad6,Рассада зелени для кухни Лаванды в горшке диам. 9 см,120.0
2019-04-27 16:00:00,14698,d3b9ffea-d143-4747-8d59-74ab843d1ad6,Рассада зелени для кухни Розмарина в горшке диам. 9 см,120.0
2019-04-27 16:00:00,14698,d3b9ffea-d143-4747-8d59-74ab843d1ad6,Рассада клубники Зенга Зенгана в кассете по E6,285.0
2019-04-27 16:00:00,14698,d3b9ffea-d143-4747-8d59-74ab843d1ad6,Рассада клубники Зенга Зенгана горшок 9х9 см P9,75.0
2019-04-27 16:00:00,14698,d3b9ffea-d143-4747-8d59-74ab843d1ad6,"томата (помидор) ""Золотая канарейка"" №32 сорт индетерминантный среднеспелый желтый",38.0
2019-04-27 16:00:00,14698,d3b9ffea-d143-4747-8d59-74ab843d1ad6,томата (помидор) Абрикос №1 сорт индетерминантный среднеспелый красный,38.0
2019-04-27 16:00:00,14698,d3b9ffea-d143-4747-8d59-74ab843d1ad6,томата (помидор) Абрикосовый брендивайн №2 сорт индетерминантный среднеспелый оранжевый,38.0
2019-04-27 16:00:00,14698,d3b9ffea-d143-4747-8d59-74ab843d1ad6,томата (помидор) Абруццо № 3 сорт индетерминантный среднеспелый красный,38.0
2019-04-27 16:00:00,14698,d3b9ffea-d143-4747-8d59-74ab843d1ad6,томата (помидор) Большая желтая зебра №10 сорт индетерминантный среднеспелый желтый,38.0
2019-04-27 16:00:00,14698,d3b9ffea-d143-4747-8d59-74ab843d1ad6,томата (помидор) Большой оранжевый №11 сорт индетерминантный среднеспелый оранжевый,38.0
2019-04-27 16:00:00,14698,d3b9ffea-d143-4747-8d59-74ab843d1ad6,томата (помидор) Большой полосатый кабан №12 сорт индетерминантный среднеспелый красный,38.0
2019-04-27 16:00:00,14698,d3b9ffea-d143-4747-8d59-74ab843d1ad6,томата (помидор) Вернисаж черный №17 сорт индетерминантный раннеспелый черный,38.0
2019-04-27 16:00:00,14698,d3b9ffea-d143-4747-8d59-74ab843d1ad6,томата (помидор) Голубой ручей №23 сорт индетерминантный среднеспелый синий,38.0
2019-04-27 16:00:00,14698,d3b9ffea-d143-4747-8d59-74ab843d1ad6,томата (помидор) Графити № 40 сорт индетерминантный раннеспелый красный,38.0
2019-04-27 16:00:00,14698,d3b9ffea-d143-4747-8d59-74ab843d1ad6,томата (помидор) Грейпфрут № 43 сорт индетерминантный среднеспелый оранжевый,38.0
2019-04-27 16:00:00,14698,d3b9ffea-d143-4747-8d59-74ab843d1ad6,томата (помидор) Земляника оранжевая №31 сорт индетерминантный среднеспелый оранжевый,38.0
2019-04-27 16:00:00,14698,d3b9ffea-d143-4747-8d59-74ab843d1ad6,томата (помидор) Исуповский №37 сорт индетерминантный среднеспелый красный,38.0
2019-04-27 16:00:00,14698,d3b9ffea-d143-4747-8d59-74ab843d1ad6,томата (помидор) К 25-56 № 78 сорт детерминантный среднеспелый черный,38.0
2019-04-27 16:00:00,14698,d3b9ffea-d143-4747-8d59-74ab843d1ad6,томата (помидор) Король красоты №46 сорт индетерминантный среднеспелый оранжевый,38.0
2019-04-27 16:00:00,14698,d3b9ffea-d143-4747-8d59-74ab843d1ad6,томата (помидор) Красный пушистый кабан №47 сорт детерминантный среднеспелый красный,38.0
2019-04-27 16:00:00,14698,d3b9ffea-d143-4747-8d59-74ab843d1ad6,томата (помидор) Кумато №49 сорт детерминантный среднеспелый черный,38.0
2019-04-27 16:00:00,14698,d3b9ffea-d143-4747-8d59-74ab843d1ad6,томата (помидор) Медовый № 93 сорт индетерминантный позднеспелый розовый,38.0
2019-04-27 16:00:00,14698,d3b9ffea-d143-4747-8d59-74ab843d1ad6,томата (помидор) Минусинские № 94 сорт индетерминантный среднеспелый розовый,38.0
2019-04-27 16:00:00,14698,d3b9ffea-d143-4747-8d59-74ab843d1ad6,томата (помидор) Мохнатый кейт №55 сорт детерминантный среднеспелый синий,38.0
2019-04-27 16:00:00,14698,d3b9ffea-d143-4747-8d59-74ab843d1ad6,томата (помидор) Мэризол Мэджик № 95 сорт индетерминантный среднеспелый оранжевый,38.0
2019-04-27 16:00:00,14698,d3b9ffea-d143-4747-8d59-74ab843d1ad6,томата (помидор) Оранжевый русский № 97 сорт индетерминантный среднеспелый оранжевый,38.0
2019-04-27 16:00:00,14698,d3b9ffea-d143-4747-8d59-74ab843d1ad6,томата (помидор) Оранжевый с фиолетовыми пятнами № 98 сорт индетерминантный среднеспелый оранжевый,38.0
2019-04-27 16:00:00,14698,d3b9ffea-d143-4747-8d59-74ab843d1ad6,томата (помидор) Полосатый шоколад №65 сорт индетерминантный среднеспелый черный,38.0
2019-04-27 16:00:00,14698,d3b9ffea-d143-4747-8d59-74ab843d1ad6,томата (помидор) Примари колорз №67 сорт детерминантный среднеспелый черный,38.0
2019-04-27 16:00:00,14698,d3b9ffea-d143-4747-8d59-74ab843d1ad6,томата (помидор) Пурпурная страсть № 101 сорт индетерминантный среднеспелый черный,38.0
2019-04-27 16:00:00,14698,d3b9ffea-d143-4747-8d59-74ab843d1ad6,томата (помидор) Роджеро № 104 сорт индетерминантный среднеспелый красный,38.0
2019-04-27 16:00:00,14698,d3b9ffea-d143-4747-8d59-74ab843d1ad6,томата (помидор) Розовый мохнатый кабан № 105 сорт индетерминантный среднеспелый розовый,38.0
2019-04-27 16:00:00,14698,d3b9ffea-d143-4747-8d59-74ab843d1ad6,томата (помидор) Синий тигр №75 сорт индетерминантный среднеспелый синий,38.0
2019-04-27 16:00:00,14698,d3b9ffea-d143-4747-8d59-74ab843d1ad6,томата (помидор) Сладкий Касади №76 сорт индетерминантный среднеспелый оранжевый,38.0
2019-04-27 16:00:00,14698,d3b9ffea-d143-4747-8d59-74ab843d1ad6,томата (помидор) Спящая леди № 108 сорт детерминантный среднеспелый черный,38.0
2019-04-27 16:00:00,14698,d3b9ffea-d143-4747-8d59-74ab843d1ad6,томата (помидор) Танцы со смурфиками № 111 сорт индетерминантный раннеспелый черный,38.0
2019-04-27 16:00:00,14698,d3b9ffea-d143-4747-8d59-74ab843d1ad6,томата (помидор) Темная галактика №79 сорт детерминантный среднеспелый черный,38.0
2019-04-27 16:00:00,14698,d3b9ffea-d143-4747-8d59-74ab843d1ad6,томата (помидор) Улыбка Розы № 113 сорт детерминантный раннеспелый синий,38.0
2019-04-27 16:00:00,14698,d3b9ffea-d143-4747-8d59-74ab843d1ad6,томата (помидор) Фейерверк № 114 сорт индетерминантный среднеспелый красный,38.0
2019-04-27 16:00:00,14698,d3b9ffea-d143-4747-8d59-74ab843d1ad6,томата (помидор) Шахерезада №84 сорт детерминантный среднеспелый красный,38.0
2019-04-27 16:00:00,14698,d3b9ffea-d143-4747-8d59-74ab843d1ad6,томата (помидор) Ширли сердцевидный № 119 сорт индетерминантный среднеспелый розовый,38.0
2019-04-27 16:00:00,14698,d3b9ffea-d143-4747-8d59-74ab843d1ad6,томата (помидор) Этуаль №85 сорт детерминантный среднеспелый розовый,38.0
2019-04-27 16:00:00,14698,d3b9ffea-d143-4747-8d59-74ab843d1ad6,томата (помидор) Южный вечер № 120 сорт детерминантный среднеспелый черный,38.0
2019-04-27 16:00:00,14698,d3b9ffea-d143-4747-8d59-74ab843d1ad6,томата (помидор) Юсуповский Узбекский №86 сорт индетерминантный позднеспелый красный,38.0
2019-04-27 16:00:00,14698,d3b9ffea-d143-4747-8d59-74ab843d1ad6,"Флокс метельчатый сорт Мари, диаметр горшка 10см.",135.0
2019-04-27 16:00:00,14698,d3b9ffea-d143-4747-8d59-74ab843d1ad6,"Флокс метельчатый сорт МОСКВИЧКА, диаметр горшка 10см.",135.0
2019-04-27 22:00:00,71307,3e1c6038-f409-43d3-b5c3-58ee67b9da76,"Штора со встроенными кольцами под штангу для ванны и душа жаккард, полиамидное покрытие, 180х200, розовый, HSC/ST04/pink",1200.0
2019-04-27 22:00:00,71306,cbc7a960-a1be-45ab-921f-a515e2003870,Банка с крышкой Attribute 500 мл и бугельным замком JAR500,254.0
2019-04-28 13:00:00,14700,b6da6f7a-d2a3-424a-878e-1876c8b88126,Дыня Симпатия Р-9,76.0
2019-04-28 13:00:00,14700,b6da6f7a-d2a3-424a-878e-1876c8b88126,Рассада Арбуза сорт Огонек горшок 9х9 см P-9,114.0
2019-04-28 13:00:00,14700,b6da6f7a-d2a3-424a-878e-1876c8b88126,Рассада Арбуза сорт Шуга Бэби горшок 9х9 см P-9,114.0
2019-04-28 13:00:00,14700,b6da6f7a-d2a3-424a-878e-1876c8b88126,Рассада Дыни сорт Дина горшок 9х9 см P-9,114.0
2019-04-28 13:00:00,14700,b6da6f7a-d2a3-424a-878e-1876c8b88126,Рассада Дыни сорт Эфиопка горшок 9х9 см P-9,114.0
2019-04-28 13:00:00,14700,b6da6f7a-d2a3-424a-878e-1876c8b88126,Рассада Капусты белокачанная сорт Июньская кассета 6 шт E6,120.0
2019-04-28 13:00:00,14700,b6da6f7a-d2a3-424a-878e-1876c8b88126,Рассада Капусты белокачанная сорт Слава кассета 6 шт E6,240.0
2019-04-28 13:00:00,14700,b6da6f7a-d2a3-424a-878e-1876c8b88126,Рассада Капусты белокачанная сорт Универс кассета 6 шт E6,120.0
2019-04-28 17:00:00,14701,cce13789-408b-44e1-8147-3c74dc393bf1,Агератум рассада однолетних цветов в кассете по 10 шт,420.0
2019-04-28 17:00:00,14701,cce13789-408b-44e1-8147-3c74dc393bf1,Алиссум рассада однолетних цветов в кассете по 10 шт,420.0
2019-04-28 17:00:00,14701,cce13789-408b-44e1-8147-3c74dc393bf1,Виола рассада однолетних цветов в кассете по 10 шт,420.0
2019-04-28 17:00:00,14701,cce13789-408b-44e1-8147-3c74dc393bf1,Колеус рассада однолетних цветов в кассете по 10 шт,420.0
2019-04-28 17:00:00,14701,cce13789-408b-44e1-8147-3c74dc393bf1,Петуния махровая рассада однолетних цветов в кассете по 10 шт,2.0
2019-04-28 17:00:00,14701,cce13789-408b-44e1-8147-3c74dc393bf1,Подвесное кашпо Бакопа ампельная мега-крупная смесь окрасок объем 4 л,488.0
2019-04-28 17:00:00,14701,cce13789-408b-44e1-8147-3c74dc393bf1,Подвесное кашпо Вербена микс Victoria смесь окрасок объем 4 л,488.0
2019-04-28 17:00:00,14701,cce13789-408b-44e1-8147-3c74dc393bf1,Подвесное кашпо Калибрахоа Confetti Mysweetheart смесь махровых окрасок объем 4 л,488.0
2019-04-28 17:00:00,14701,cce13789-408b-44e1-8147-3c74dc393bf1,Подвесное кашпо Петуния микс смесь окрасок объем 4 л,488.0
2019-04-28 17:00:00,14701,cce13789-408b-44e1-8147-3c74dc393bf1,Тагетис крупноцветковый рассада однолетних цветов в кассете по 10 шт,420.0
2019-04-28 17:00:00,14701,cce13789-408b-44e1-8147-3c74dc393bf1,Цинерания рассада однолетних цветов в кассете по 10 шт,420.0
2019-04-28 17:00:00,71309,2e7b6794-3bb6-49c5-a3f5-897f7e4f581a,"Таз пластмассовый 15,0 л пищевой (Галс), 1404057",142.0
2019-04-29 08:00:00,71310,2b6439c9-1ae1-4785-9509-ca4348b3d39a,Муляж Клубника 1 шт полиуретан d-6 см,22.0
2019-04-29 10:00:00,71311,259b381f-e37c-4daf-8d61-731fb94a5824,"Щетка-сметка 4-х рядная деревянная 300 мм (фигурная ручка) ворс 5,5 см 1801096",1920.0
2019-04-29 12:00:00,14704,d9f01c41-8d14-4231-9396-07a265cb39ef,Пеларгония розебудная Margaretha укорененный черенок,135.0
2019-04-29 12:00:00,14704,d9f01c41-8d14-4231-9396-07a265cb39ef,Пеларгония розебудная Mary укорененный черенок,135.0
2019-04-29 12:00:00,14704,d9f01c41-8d14-4231-9396-07a265cb39ef,Пеларгония розебудная Prins Nikolai укорененный черенок,135.0
2019-04-29 12:00:00,14704,d9f01c41-8d14-4231-9396-07a265cb39ef,Пеларгония розебудная Queen Ingrid укорененный черенок,135.0
2019-04-29 12:00:00,14704,d9f01c41-8d14-4231-9396-07a265cb39ef,Пеларгония розебудная Red Pandora укорененный черенок,135.0
2019-04-29 12:00:00,14704,d9f01c41-8d14-4231-9396-07a265cb39ef,Пеларгония розебудная Rosebud Red d-7 см,135.0
2019-04-29 13:00:00,14705,603e92a4-fc7f-4203-9ca5-103da5b008ac,Алиссум рассада однолетних цветов в кассете по 6 шт,128.0
2019-04-29 13:00:00,14705,603e92a4-fc7f-4203-9ca5-103da5b008ac,"Бакопа ампельная мега-крупная белая объем 0,5 л",90.0
2019-04-29 13:00:00,14705,603e92a4-fc7f-4203-9ca5-103da5b008ac,Газания рассада однолетних цветов в кассете по 10 шт,352.0
2019-04-29 13:00:00,14705,603e92a4-fc7f-4203-9ca5-103da5b008ac,Газания рассада однолетних цветов в кассете по 6 шт,2.0
2019-04-29 13:00:00,14705,603e92a4-fc7f-4203-9ca5-103da5b008ac,"Калибрахоа Aloha Tiki Neon малиновая объем 0,5 л",90.0
2019-04-29 13:00:00,14705,603e92a4-fc7f-4203-9ca5-103da5b008ac,"Калибрахоа Mini Famous Double Blue фиолетовая махровая объем 0,5 л",90.0
2019-04-29 13:00:00,14705,603e92a4-fc7f-4203-9ca5-103da5b008ac,"Калибрахоа Sweet Bells Double Golden желтая махровая объем 0,5 л",90.0
2019-04-29 13:00:00,14705,603e92a4-fc7f-4203-9ca5-103da5b008ac,Лобелия рассада однолетних цветов в кассете по 6 шт,128.0
2019-04-29 13:00:00,14705,603e92a4-fc7f-4203-9ca5-103da5b008ac,"Лобелия Регатта Regatta микс объем 0,5 л",120.0
2019-04-29 13:00:00,14705,603e92a4-fc7f-4203-9ca5-103da5b008ac,"Однолетнее растение Алиссум в кассете по 4 шт, Россия",82.0
2019-04-29 13:00:00,14705,603e92a4-fc7f-4203-9ca5-103da5b008ac,"Однолетнее растение Виола в кассете по 4 шт, Россия",82.0
2019-04-29 13:00:00,14705,603e92a4-fc7f-4203-9ca5-103da5b008ac,"Однолетнее растение Табак душистый в кассете по 4 шт, Россия",82.0
2019-04-29 13:00:00,14705,603e92a4-fc7f-4203-9ca5-103da5b008ac,"Однолетнее растение Тагетис мелкоцветковый в кассете по 4 шт, Россия",82.0
2019-04-29 13:00:00,14705,603e92a4-fc7f-4203-9ca5-103da5b008ac,"Однолетнее растение Циния в кассете 4 шт, Россия",82.0
2019-04-29 13:00:00,14705,603e92a4-fc7f-4203-9ca5-103da5b008ac,Петуния махровая рассада однолетних цветов в кассете по 10 шт,2.0
2019-04-29 13:00:00,14705,603e92a4-fc7f-4203-9ca5-103da5b008ac,"Петуния Potunia Plus Purple бургунди с прожилками объем 0,5 л",90.0
2019-04-29 13:00:00,14705,603e92a4-fc7f-4203-9ca5-103da5b008ac,"Петуния Surfinia Blue Sky небесно-голубой объем 0,5 л",90.0
2019-04-29 13:00:00,14705,603e92a4-fc7f-4203-9ca5-103da5b008ac,"Петуния Surfinia Crazy Pink розовая с прожилкой объем 0,5 л",90.0
2019-04-29 13:00:00,14705,603e92a4-fc7f-4203-9ca5-103da5b008ac,"Петуния Surfinia Doble Lilac светло-сиреневая махровая объем 0,5 л",90.0
2019-04-29 13:00:00,14705,603e92a4-fc7f-4203-9ca5-103da5b008ac,"Петуния Surfinia Doble White белая махровая объем 0,5 л",90.0
2019-04-29 13:00:00,14705,603e92a4-fc7f-4203-9ca5-103da5b008ac,"Петуния Sweetunia Miss Marvelous винно-белая звезда объем 0,5 л",90.0
2019-04-29 13:00:00,14705,603e92a4-fc7f-4203-9ca5-103da5b008ac,Подвесное кашпо Гелихризум серебристая объем 4 л,488.0
2019-04-29 13:00:00,14705,603e92a4-fc7f-4203-9ca5-103da5b008ac,"Рассада зелени для кухни Мелисса лимонная зеленый объем 0,75 л",89.0
2019-04-29 13:00:00,14705,603e92a4-fc7f-4203-9ca5-103da5b008ac,Рассада зелени для кухни Мяты в горшке диам. 9 см,120.0
2019-04-29 13:00:00,14705,603e92a4-fc7f-4203-9ca5-103da5b008ac,"Рассада Остеоспермум крупноцветковый Lavender сиреневый объем 0,5 л",119.0
2019-04-29 13:00:00,14705,603e92a4-fc7f-4203-9ca5-103da5b008ac,"Рассада Остеоспермум крупноцветковый Purple малиновый объем 0,5 л",127.0
2019-04-29 13:00:00,14705,603e92a4-fc7f-4203-9ca5-103da5b008ac,"Рассада Остеоспермум крупноцветковый White белый объем 0,5 л",119.0
2019-04-29 13:00:00,14705,603e92a4-fc7f-4203-9ca5-103da5b008ac,Табак душистый рассада однолетних цветов в кассете по 6 шт,128.0
2019-04-29 13:00:00,14705,603e92a4-fc7f-4203-9ca5-103da5b008ac,Тагетис крупноцветковый рассада однолетних цветов в кассете по 6 шт,128.0
2019-04-29 17:00:00,71320,fbb47f3f-2366-4179-88c9-a38369cef8bb,Муррайя d-9 см,37.0
2019-04-29 20:00:00,14706,b6da6f7a-d2a3-424a-878e-1876c8b88126,Рассада Арбуза сорт Огонек горшок 9х9 см P-9,114.0
2019-04-29 20:00:00,14706,b6da6f7a-d2a3-424a-878e-1876c8b88126,Рассада Арбуза сорт Шуга Бэби горшок 9х9 см P-9,114.0
2019-04-29 20:00:00,14706,b6da6f7a-d2a3-424a-878e-1876c8b88126,Рассада Дыни сорт Дина горшок 9х9 см P-9,114.0
2019-04-29 20:00:00,14706,b6da6f7a-d2a3-424a-878e-1876c8b88126,Рассада Дыни сорт Эфиопка горшок 9х9 см P-9,114.0
2019-04-29 20:00:00,14706,b6da6f7a-d2a3-424a-878e-1876c8b88126,Рассада Капусты белокачанная сорт Июньская кассета 6 шт E6,240.0
2019-04-29 20:00:00,14706,b6da6f7a-d2a3-424a-878e-1876c8b88126,Рассада Капусты белокачанная сорт Слава кассета 6 шт E6,360.0
2019-04-29 22:00:00,14709,3f0b8742-e7ce-4168-bde7-e7e743153896,Пеларгония зональная махровая лососевая,188.0
2019-04-29 22:00:00,14709,3f0b8742-e7ce-4168-bde7-e7e743153896,Пеларгония розебудная Prins Nikolai укорененный черенок,135.0
2019-04-29 22:00:00,14709,3f0b8742-e7ce-4168-bde7-e7e743153896,Пеларгония розебудная Queen Ingrid укорененный черенок,135.0
2019-04-29 22:00:00,14709,3f0b8742-e7ce-4168-bde7-e7e743153896,Пеларгония розебудная Red Pandora укорененный черенок,135.0
2019-04-29 22:00:00,14709,3f0b8742-e7ce-4168-bde7-e7e743153896,Пеларгония Toscana Angeleyes Bicolor укорененный черенок,112.0
2019-04-30 11:00:00,71322,69b17a52-a59b-4656-8d47-375e81e7d5f1,Гладильная доска НИКА ЭЛЬЗА Премиум 122х40 см ЭЛП,1574.0
2019-04-30 14:00:00,14711,5ec40dfb-b057-4895-bfc8-1c82cb5136f9,"Вербена ампельная, диам. 21 см",449.0
2019-04-30 14:00:00,14711,5ec40dfb-b057-4895-bfc8-1c82cb5136f9,Лобелия рассада однолетних цветов в кассете по 6 шт,128.0
